id,title,authors_or_org,year,source_type,discipline,url_or_doi,reliability_tier,relevance_score,key_claim,artistic_bridge,notes
S067,"Systemic Risk and Stability in Financial Networks","Daron Acemoglu; Asuman Ozdaglar; Alireza Tahbaz-Salehi",2015,"peer-reviewed article","financial networks","https://doi.org/10.1257/aer.20130456",A,3,"Dense financial connections can improve stability for small shocks but spread large shocks.","Mechanism bridge: edge strengthening has non-monotonic consequences.","American Economic Review."
S068,"Systemic Risk in Financial Systems","Larry Eisenberg; Thomas H. Noe",2001,"peer-reviewed article","financial clearing networks","https://doi.org/10.1287/mnsc.47.2.236.9835",A,3,"Defines clearing payments in networks of interdependent liabilities.","Accounting bridge: financial edges can conserve obligations and transmit default.","Management Science."
S069,"Financial Contagion","Franklin Allen; Douglas Gale",2000,"peer-reviewed article","financial networks","https://doi.org/10.1086/262109",A,3,"Interbank claims can share liquidity risk or transmit contagion depending on topology.","Mechanism bridge: connectivity can have two opposing roles.","Journal of Political Economy."
S070,"Contagion in Financial Networks","Prasanna Gai; Sujit Kapadia",2010,"central-bank working paper","financial networks","https://www.bankofengland.co.uk/working-paper/2010/contagion-in-financial-networks",A,3,"Models default cascades and robust-yet-fragile network behavior.","Mechanism bridge: rare cascades provide nonlinear crisis transitions.","Bank of England Working Paper 383."
S071,"DebtRank: Too Central to Fail? Financial Networks, the FED and Systemic Risk","Stefano Battiston; Michelangelo Puliga; Rahul Kaushik; Paolo Tasca; Guido Caldarelli",2012,"peer-reviewed article","systemic risk","https://doi.org/10.1038/srep00541",A,2,"Introduces a recursive measure of distress propagation through financial networks.","Method bridge: edge flows can expose system-wide influence without decorative animation.","Scientific Reports."
S072,"Network Models of Financial Systemic Risk: A Review","Fabio Caccioli; Paolo Barucca; Teruyoshi Kobayashi",2018,"review article","financial networks","https://doi.org/10.1007/s42001-017-0008-3",A,3,"Reviews default cascades, overlapping portfolios and empirical interbank networks.","Scope bridge: helps exclude mechanisms too complex for the first model.","Journal of Computational Social Science."
S073,"Systemic Risk in Financial Networks: A Survey","Matthew O. Jackson; Agathe Pernoud",2021,"review article","financial networks","https://doi.org/10.1146/annurev-economics-083120-111540",A,3,"Surveys direct contagion, fire sales, runs, credit freezes and network formation.","Model bridge: supports selecting credit freeze rather than full default cascades for v1.","Annual Review of Economics."
S074,"How Likely Is Contagion in Financial Networks?","Paul Glasserman; H. Peyton Young",2015,"peer-reviewed article","financial networks","https://doi.org/10.1016/j.jbankfin.2014.02.006",A,2,"Provides conditions governing loss amplification and contagion likelihood.","Method bridge: stability checks need explicit bounds and stress tests.","Journal of Banking and Finance."
S075,"The Dynamics of the Leverage Cycle","Christoph Aymanns; J. Doyne Farmer",2015,"peer-reviewed article","leverage cycles","https://doi.org/10.1016/j.jedc.2015.04.015",A,3,"Risk-sensitive leverage adjustment can generate endogenous leverage cycles and instability.","Mechanism bridge: bank risk appetite can be a slow destabilizing state.","Journal of Economic Dynamics and Control."
S076,"Elimination of Systemic Risk in Financial Networks by Means of a Systemic Risk Transaction Tax","Sebastian Poledna; Stefan Thurner",2016,"peer-reviewed article","financial networks","https://doi.org/10.1080/14697688.2015.1110170",A,2,"Network-aware intervention can reduce systemic risk more efficiently than volume-only rules.","Interaction bridge: edge-specific interventions can matter more than global damping.","Quantitative Finance."
S077,"A Macroeconomic Model with a Financial Sector","Markus Brunnermeier; Yuliy Sannikov",2014,"peer-reviewed article","macro-financial dynamics","https://doi.org/10.1257/aer.104.2.379",A,3,"Nonlinear financial amplification creates asymmetric responses and volatility near constrained states.","Mechanism bridge: calm and crisis regimes can coexist in one deterministic model.","American Economic Review."
S078,"Liquidity and Leverage","Tobias Adrian; Hyun Song Shin",2010,"peer-reviewed article","financial cycles","https://doi.org/10.1016/j.jfi.2008.12.002",A,3,"Intermediary balance-sheet leverage is procyclical and linked to liquidity.","Node bridge: credit availability should depend on bank leverage or capital.","Journal of Financial Intermediation."
S079,"The Financial Accelerator in a Quantitative Business Cycle Framework","Ben S. Bernanke; Mark Gertler; Simon Gilchrist",1999,"handbook chapter","macro-financial economics","https://doi.org/10.1016/S1574-0048(99)10034-X",A,3,"Borrower net worth and external finance premia amplify real shocks.","Mechanism bridge: profits-credit-investment form a reinforcing loop.","Handbook of Macroeconomics."
S080,"Credit Cycles","Nobuhiro Kiyotaki; John Moore",1997,"peer-reviewed article","macro-financial economics","https://doi.org/10.1086/262072",A,3,"Collateral constraints propagate and amplify shocks over time.","Mechanism bridge: delayed balance-sheet recovery produces persistence.","Journal of Political Economy."
S081,"Inventories and the Business Cycle: An Overview","Alan S. Blinder; Louis J. Maccini",1991,"peer-reviewed review","inventory economics","https://doi.org/10.2307/2728145",A,3,"Reviews why inventory movements are central to business-cycle fluctuations.","Node bridge: inventory gap deserves an explicit state rather than hidden damping.","Journal of Economic Perspectives."
S082,"Inventories","Valerie A. Ramey; Kenneth D. West",1999,"handbook chapter","inventory economics","https://doi.org/10.1016/S1574-0048(99)10010-7",A,3,"Reviews inventory facts and models across the business cycle.","Calibration bridge: inventory adjustment speed and persistence need plausible ranges.","Handbook of Macroeconomics."
S083,"Inventories and the Business Cycle: An Equilibrium Analysis of (S,s) Policies","Aubhik Khan; Julia K. Thomas",2007,"peer-reviewed article","inventory economics","https://doi.org/10.1257/aer.97.4.1165",A,2,"Studies firm inventory policies and their aggregate business-cycle implications.","Mechanism bridge: nonlinear restocking thresholds can be a later extension.","American Economic Review."
S084,"What Inventory Behavior Tells Us about Business Cycles","Mark Bils; James A. Kahn",2000,"peer-reviewed article","inventory economics","https://doi.org/10.1257/aer.90.3.458",A,3,"Inventory-sales relationships reveal demand persistence and production adjustment.","Evidence bridge: demand and production should not move simultaneously by construction.","American Economic Review."
S085,"Modeling Managerial Behavior: Misperceptions of Feedback in a Dynamic Decision Making Experiment","John D. Sterman",1989,"peer-reviewed article","system dynamics","https://doi.org/10.1287/mnsc.35.3.321",A,2,"People systematically misread delayed feedback in inventory systems.","Interaction bridge: controller changes should produce delayed but learnable consequences.","Management Science."
S086,"Information Distortion in a Supply Chain: The Bullwhip Effect","Hau L. Lee; V. Padmanabhan; Seungjin Whang",1997,"peer-reviewed article","supply-chain dynamics","https://doi.org/10.1287/mnsc.43.4.546",A,2,"Ordering and information delays can amplify demand variability upstream.","Mechanism bridge: delayed directed production edges can amplify modest shocks.","Management Science."
S087,"Discretion versus Policy Rules in Practice","John B. Taylor",1993,"peer-reviewed article","monetary policy","https://doi.org/10.1016/0167-2231(93)90009-L",A,3,"A simple interest-rate feedback rule responds to inflation and activity.","Node bridge: policy stance can be a balancing feedback with adjustable gains.","Carnegie-Rochester Conference Series."
S088,"Monetary Policy Rules and Macroeconomic Stability: Evidence and Some Theory","Richard Clarida; Jordi Galí; Mark Gertler",2000,"peer-reviewed article","monetary policy","https://doi.org/10.1162/003355300554692",A,3,"Policy feedback coefficients affect determinacy and macro stability.","Mechanism bridge: policy edge weights can move the system between stable and unstable regimes.","Quarterly Journal of Economics."
S089,"Nominal Rigidities and the Dynamic Effects of a Shock to Monetary Policy","Lawrence J. Christiano; Martin Eichenbaum; Charles L. Evans",2005,"peer-reviewed article","monetary transmission","https://doi.org/10.1086/426038",A,2,"Investment, consumption, inflation and output respond persistently to monetary shocks.","Timing bridge: policy effects should propagate with inertia rather than instantly.","Journal of Political Economy."
S090,"Shocks and Frictions in US Business Cycles: A Bayesian DSGE Approach","Frank Smets; Rafael Wouters",2007,"peer-reviewed article","empirical macroeconomics","https://doi.org/10.1257/aer.97.3.586",A,2,"Estimates a medium-scale model with nominal and real frictions against US data.","Calibration bridge: provides plausible signs and persistence even if v1 is not DSGE.","American Economic Review."
S091,"Input-Output Accounts Data","U.S. Bureau of Economic Analysis",2025,"official dataset","national accounts","https://www.bea.gov/industry/input-output-accounts-data",A,3,"Provides official US supply-use and input-output relationships.","Data bridge: calibrate direction and rough strength of production dependencies.","Official dataset portal."
S092,"Inter-Country Input-Output Tables","OECD",2023,"official dataset","international production networks","https://www.oecd.org/sti/ind/inter-country-input-output-tables.htm",A,3,"Provides internationally harmonized inter-country production linkages.","Data bridge: supports future open-economy or sector-network variants.","Official OECD database."
S093,"World Input-Output Database","WIOD Consortium",2016,"official research dataset","global input-output economics","https://www.rug.nl/ggdc/valuechain/wiod/",A,3,"Provides world input-output tables and socioeconomic accounts.","Data bridge: empirical network topology reference.","University-hosted research database."
S094,"Supply, Use and Input-Output Tables","Eurostat",2025,"official dataset","European national accounts","https://ec.europa.eu/eurostat/web/esa-supply-use-input-tables",A,2,"Provides harmonized European supply-use and input-output tables.","Data bridge: alternative calibration source for production edges.","Official EU dataset."
S095,"Financial Accounts of the United States (Z.1)","Federal Reserve Board",2025,"official dataset","sector balance sheets","https://www.federalreserve.gov/releases/z1/",A,3,"Provides sector financial assets, liabilities and flows.","Data bridge: calibrate household, firm, bank and government balance relations.","Official Federal Reserve release."
S096,"FRED Economic Data","Federal Reserve Bank of St. Louis",2025,"official database","macroeconomic time series","https://fred.stlouisfed.org/",A,3,"Aggregates official macroeconomic time series with stable identifiers.","Data bridge: compare simulated periods, signs and lag structure with observed series.","Official Federal Reserve database."
S097,"Total Credit to the Non-Financial Sector","Bank for International Settlements",2025,"official dataset","credit cycles","https://www.bis.org/statistics/totcredit.htm",A,3,"Provides long-run private and public credit series across economies.","Data bridge: ground credit stock and leverage ranges.","Official BIS statistics."
S098,"Credit-to-GDP Gaps","Bank for International Settlements",2025,"official dataset","financial cycles","https://www.bis.org/statistics/c_gaps.htm",A,3,"Provides standardized credit-gap indicators used in macroprudential analysis.","Data bridge: assess whether simulated credit booms are plausible.","Official BIS statistics."
S099,"International Financial Statistics","International Monetary Fund",2025,"official dataset","international macroeconomics","https://data.imf.org/IFS",A,2,"Provides monetary, financial, price and external-sector time series.","Data bridge: cross-country calibration and validation.","Official IMF database."
S100,"World Economic Outlook Database","International Monetary Fund",2025,"official dataset","macroeconomic aggregates","https://www.imf.org/en/Publications/WEO/weo-database/2025/April",A,2,"Provides comparable GDP, inflation, unemployment and fiscal series.","Data bridge: empirical ranges for aggregate observables.","Official IMF database."
S101,"World Development Indicators","World Bank",2025,"official dataset","development macroeconomics","https://databank.worldbank.org/source/world-development-indicators",A,2,"Provides cross-country macroeconomic and structural indicators.","Data bridge: test parameter robustness across different economic structures.","Official World Bank database."
S102,"ILOSTAT Data Explorer","International Labour Organization",2025,"official dataset","labor economics","https://rshiny.ilo.org/dataexplorer/",A,2,"Provides employment, unemployment, wages and labor-force indicators.","Data bridge: ground employment-wage loop ranges.","Official ILO database."
S103,"Productivity and Costs","U.S. Bureau of Labor Statistics",2025,"official dataset","productivity","https://www.bls.gov/lpc/",A,2,"Provides official labor productivity, output, hours and unit labor cost series.","Data bridge: connect production, employment and wage cost observables.","Official BLS program."
S104,"Main Economic Indicators","OECD",2025,"official dataset","business-cycle indicators","https://www.oecd.org/sdd/leading-indicators/",A,2,"Provides comparable short-term indicators and composite leading indicators.","Data bridge: check qualitative timing and phase relations.","Official OECD statistics."
S105,"ECB Data Portal","European Central Bank",2025,"official dataset","monetary and financial statistics","https://data.ecb.europa.eu/",A,2,"Provides euro-area monetary, lending, rates, prices and real-economy series.","Data bridge: policy-credit-inflation calibration source.","Official ECB database."
S106,"System of National Accounts 2008","United Nations; European Commission; IMF; OECD; World Bank",2009,"international standard","national accounting","https://unstats.un.org/unsd/nationalaccount/docs/SNA2008.pdf",A,3,"Defines internationally accepted stocks, flows, sectors and accounting identities.","Method bridge: model state names and flows should respect real accounting categories.","International statistical standard."
S107,"OECD System of Composite Leading Indicators","OECD",2012,"technical reference","business-cycle measurement","https://www.oecd.org/sdd/leading-indicators/41629509.pdf",A,2,"Documents construction and interpretation of composite leading indicators.","Method bridge: informs validation of phase and turning points.","Official methodology."
S108,"Financial Cycle Measurement: A Review","Bank for International Settlements",2014,"institutional working paper","financial-cycle measurement","https://www.bis.org/publ/work421.htm",A,2,"Reviews frequency and measurement of financial cycles relative to business cycles.","Method bridge: credit dynamics may operate on a slower timescale than inventories.","BIS Working Paper 421."
S109,"Minsky: System Dynamics for Economics","Steve Keen and collaborators",2025,"research software","stock-flow consistent simulation","https://sourceforge.net/projects/minsky/",B,2,"Implements visual stock-flow consistent economic modeling with accounting tables.","Technical bridge: precedent for editable causal-economic graphs.","Open-source research tool."
S110,"LSD: Laboratory for Simulation Development","Marco Valente; Mauro Gallegati et al.",2025,"research software","agent-based simulation","https://www.labsimdev.org/",B,2,"Supports modular discrete-time economic simulation and sensitivity experiments.","Technical bridge: precedent for repeatable parameter sweeps and model modules.","Research simulation platform."
